{
  "task_id": "minedojo_techtree_oak_planks",
  "source": "minedojo",
  "category": "techtree",
  "family": "TechTree",
  "goal": "Craft four oak planks from one oak log.",
  "description": "Curated MineDojo-style tech-tree task for the first crafting transition.",
  "allowed_actions": ["query_inventory", "request_visual_snapshot", "scan_blocks", "scan_dropped_items", "move_to", "dig_block_at", "wait_ticks", "craft_item", "place_block", "use_item", "fight_entity"],
  "verifier": {"type": "inventory_contains", "item": "oak_planks", "count": 4},
  "success_criteria": {"type": "inventory_contains", "item": "oak_planks", "count": 4},
  "knowledge_tags": ["minecraft:item/oak_planks", "minecraft:recipe/oak_planks", "minecraft:crafting"],
  "runtime_profile": "benchmark-minimal",
  "minedojo": {
    "task_family": "techtree",
    "programmatic": true,
    "creative": false
  },
  "benchmark": {
    "seed": 6201,
    "difficulty": "normal",
    "max_steps": 1,
    "initial_state": {
      "inventory": [{"name": "oak_log", "count": 1}],
      "nearby_blocks": [],
      "nearby_entities": []
    },
    "scripted_actions": [
      {"type": "craft_item", "args": {"item": "oak_planks", "count": 4}}
    ]
  }
}
